,x,y
0,tried to turn right into me on my bike after we both came to a complete stop at the stopsign,2.0
1,a van driver pulled out suddenly from a side street in front of me and i lost control of the bike sorry i realize this is just outside the red area on your map,3.0
2,i was traveling down centennial drive when the car in front of me braked suddenly i applied my bike brakes but was unable to stop in time and faced with hitting the car or ditching my bike i opted for the latter,2.0
3,i was biking heading south on gayley on the street and for some reason fell off my bike,2.0
4,while was riding home another cyclist apparently under the influence heading east downhill plowed through stop sign at high speed and slammed into my bike i had slowed but not stopped at the four way stop but could not avoid the collision because of,3.0
5,doored by driver opening door into bike lane without looking just as i was passing her parked car,0.0
6,leaving wurster hall around 10 45 11pm riding towards the campanile and i was coming down the hill and was not able to see the seperation between the sidewalk and grass and my front wheel clipped the edge of the sidewalk and grass causing me to propel off,1.0
7,i was riding through the roundabout along gayley road at channing when a pick up truck came up channing way ignored the yield sign side swiped me with his rear fender and knocked me down i was probably going about 20 mph before he hit me so it took m,3.0
8,i was riding past kerr campus between parked cars and stop and go traffic when an suv with one of those stupid cow catcher headlight grills cut in front of me without looking caught my handlebar on the grill and knocked me down broken handlebar and,2.0
9,walking across sproul plaza looking around and a biker hit me from my blind spot he was travelling backwards possibly trying light stunts so he did not see me,0.0
10,driver in front of me indicated that he was turning right took a very long time to make the turn and i realized too late that he was staying still potentially waiting for me to pass him on the right had to brake suddenly and fell,2.0
11,crossing sidewalk to cross street tire slid out from under me on a metal grate across the sidewalk,1.0
12,car door hit my leg while i was on a bike,0.0
13,car sideswiped me on my bike i flew over the bike and hurt my jaw hospital visit too out of it to call police,0.0
14,i was headed south from the parking lot between tang ctr and 2200 bancroft too much fast traffic on fulton to take that route and durant one way the wrong way so i rode my bike down the sidewalk on the north side of durant to get to the light to cross a,1.0
15,i was riding my bike south on oxford intending to make the left turn onto the crescent while crossing from the bike lane to the left turn lane my handlebar grazed the back of the car in front of me i was moving perpendicular to the lane since traffic,2.0
16,i was biking home from cory hall and lost control of my bike and fell down and hurt my head pretty badly that i had to drop the fall semester this was in front of the food court on heart avenue,2.0
17,driver opened car door into my leg while i was biking past but i swerved so the door barely hit me,2.0
18,i was biking downhill the other biker uphill he went to my right when he should have gone the other way so we could pass each other but instead we collided,4.0
19,i was riding west on channing across fulton oncoming car going south in the left lane on fulton either did not stop at stop sign or did not see me already in the intersection and went on through hitting my rear wheel before i could get out of the way,3.0
20,walking on grinnell pathway cyclist riding too fast weaving in and out of pedestrian is hit me,0.0
21,a car came quickly toward the intersection to make a right turn on red as i stepped from the sidewalk into the crosswalk while the car quickly applied the brakes i had to push myself away from the car with my hand,3.0
22,a bicyclist was following at a high speed and changing lanes quickly when i braked for a pedestrian in a crosswalk the cyclist collided with the rear of my car denting the trunk,2.0
23,biking down bancroft taking merge lane onto oxford bike lane north car came up behind me honking impatiently as i occupied the lane then car brushed against me as it passed,2.0
24,commuting to work chain slipped on bike fell off bike and scraped elbow got up dusted myself off fixed chain got back on bike went to work,4.0
25,i was crossing the pedestrian bike path behind barrows while looking down at my phone suddenly i noticed a biker screeching to a halt in front of me the tire of the bike grazed my leg but no other damage was done i apologized to the biker,4.0
26,i was turning onto the bike path and slid out on slippery leaves on the off camber turn i also remember i was probably going too fast no pedestrians were in the vicinity i have since become a better bike handler and judge of road bike path conditions,4.0
27,i was biking through sather gate and caught an edge on some uneven brickwork under south gate and fell to the ground no one was close to me i somehow twisted my thumb and received treatment a brace physical therapy,1.0
28,moving off campus on bicycle during light rain the cement was wet and very slippery as i turned a corner a tour group of some children was moving through to avoid them i had to turn hard the tires of the bicycle slipped and i skidded on the pavement,4.0
29,walking to vlsb cyclist came up from behind tried to avoid me lost control of bicycle skidded on sand dirt pathway fell off his bike and got several bleeding scrapes i went up and asked him if he was okay and if i needed to call 911 but he said he,4.0
30,on path by eucalyptus grove walking from front of lsa to back of lsa several cyclists on path one coming towards me would not go around me or yield and came to stop immediately in front of me just barely bumping front wheel to my shin no harm did not,4.0
31,i was biking on the road and a pothole combined with braking caused my bike to fall over,2.0
32,i was walking up towards euclid and this cyclist came barrelling down the hill and struck me scaring me to death he was going very fast but managed not to fall himself,0.0
33,i was walking down to bart from doe library and a cyclist brushed me causing me to fall but he was not pushed off his bike it was just before 6 there were other people around too cyclists simply do not realize how dangerous fast riding especially dow,4.0
34,occurred at a crowded area with poles in the path to block cars they could not stop and ran into me i stumbled backwards but was fine,4.0
35,biker ran into me while i was walking on a sidewalk,1.0
36,if i remember correctly i was biking and a pedestrian suddenly moved and i lightly tapped her with my bike i was not going fast no one was hurt and i apologized and we went our separate ways,4.0
37,i was biking southbound along oxford and a van made a left turn onto allston right in front of me i did not have time to stop and i cruised into the side of the van i was able to slow down enough so that i was able to safely stop myself on the van with m,3.0
38,van passed me in excessive speed slammed on the brakes and took a right turn in front of me as i was attempting to go straight in an intersection hearst and shattuck,3.0
39,car passed me in excessive speed slammed on the brakes and took a right turn in front of me as i was attempting to go straight in an intersection hearst and shattuck yes both accidents were the same situation at the same intersection,3.0
40,i was grazed by a bicycle passing me from behind this was very unsettling for a 75 year old,4.0
41,skateboarder riding skateboard down the concrete stairs to the east of sutardja dai hall this scattered the people using the stairs causing jostlings fortunately this person did not collide with anyone as a 78 year old i found this extremely uncomfo,0.0
42,i was on the sidewalk below pimentel hall the bicycle came downhill on the sidewalk behind me and was not looking it hit me on one side,1.0
43,started biking on hearst across oxford vehicle turning right was not paying attention and stopped just a little late,3.0
44,my bike veered onto the dirt when entering the downhill path which crosses over the river just southeast of the campanile the drop from the pavement to the dirt caused my bike to skid over,1.0
45,there were leaves and my bike slipped when i tried to move in order to avoid pedestrians,4.0
46,there is a wooden bridge on the road just south of moffitt library while traveling south descending the hill with too much speed i saw an approaching car and applied too much rear brake over that bridge causing the rear to slide out and a fall ther,2.0
47,bicyclist swerved to avoid a car which was turning right onto shattuck and did not see him bicyclist actually hit me as i was walking in crosswalk bicyclist apologized car driver drove away,3.0
48,a bike rider hit me while i was in a crosswalk at dana bancroft he did not stop,3.0
49,swerved to avoid girl texting on phone ran into curb and crashed bike,3.0
50,i was biking up the driveway that runs between campbell and evans toward pimentel an older woman in cycling gear was coming down that same steep road from stanley hall area piedmont street she was coming quite fast and i did not have much visibility of h,3.0
51,cyclist clipped me while i was out delivering paperwork walking through sproul plaza,1.0
52,two students in a golf card hit me from behind on the sidewalk when i was walking to my car,1.0
53,i was walking on the multi use path between memorial glade and the doe library there were several other pedestrians on the path a cyclist was traveling the opposite direction due to inattention and other pedestrians obstructing my vision i did not not,4.0
54,vespa narrowly avoided hitting me in crosswalk as it zoomed through without stopping or slowing,3.0
55,middle of upper sproul next to golden bear cafe a biker ran into me as i was walking he was doing some tricks on his bike and riding really fast and recklessly,0.0
56,i rode my bike to class in the morning and ran into a homeless man who was riding another bike i was so surprised he was in front of me but riding so slow that i sped up and prepared to pass him but when i was really close he suddenly turned on his,2.0
57,crossing the road vehicle went by i was already moving and my brake fell off do not think it was anyone is fault really,2.0
58,going through a roundabout other cyclist did not stop and we almost collided im a skilled cyclist so i managed to dodge very quickly the other person freaked out and lost control,2.0
59,fell off bike while riding to campus from berkeley lab had fractued wrist,2.0
60,i was walking home and the car bumped into me,1.0
61,me jaywalking across hearst not seeing very fast moving downhill cyclist,2.0
62,riding down bancroft towards bowditch and turned left onto bowditch as i was riding through the bowditch crossing a pedestrian suddenly turned onto the street without looking i slammed on my brakes and was able to stop in enough time to barely hit the,3.0
63,skateboarder came through lost control and skateboard went out and hit couple of people,4.0
64,skateboarder came down hill behind pedestrians veered clipped some people ran off into grass and stopped,4.0
65,bicyclist came down hill from south hall direction turned around wheeler to head north and weaved in between people cyclist brushed pedestrians and then fell when turning bike to stop,4.0
66,cyclist rode up behind weaving between pedestrians and clipped me on the way it was on the foot path along strawberry creek just past the cross bath that goes over to lsb,1.0
67,i was walking home crossing south on the west side of channing on dana the car was accelerating from a stop sign driving westbound on channing way i remember walking parallel to a vehicle that was also crossing southbound dana the vehicle i was wal,3.0
68,walking from clark kerr to the island separating warring and piedmont there is a crosswalk but no stop sign and the driver did not see me crossing until they were too close and had to slam on their breaks they missed me by about an inch,3.0
69,i was crossing bancroft and dana i was on the phone and i was no pay atention to the car until i suddently i hear a strong car break,3.0
70,incas walking by the faculty club and a bike hit me in my ankle i was nger the student ser sorry and start walking instad of riding,4.0
71,i was walking in front of the valley life science buildinig and a student riding a bike just pass next to me really fast almost hit me very hard he continious his way never stop even the speed,4.0
72,while turning left from telegraph onto durant in the outmost right lane my front tire road bike hit the edge of the metal plate mentioned above at an angle and the slick metal edge made the tire slip and i lost control of the bike and i think spun sid,2.0
73,i was already in the pedestrian crosswalk when a fast moving bicycle ran into me,3.0
74,brushed against a pedestrian that was walking in the middle of the street going in the same direction as me so they could not see me there were many pedestrians in the street,2.0
75,pedestrian was walking in the street not in a crosswalk the pedestrian walked in front of me and forced me to turn to avoid hitting them there were wet metal plates in the road because of construction and rain and the sharp turn caused me to slip on the,2.0
76,a skateboarder was using the sidewalk improperly and hit me,1.0
77,a cyclist was going too fast and then proceeded to yell at me after i legally crossed,3.0
78,i was walking back from class and the cyclist was going downhill way too fast i did not see him until he hit me with his bag which was on one shoulder,1.0
79,riding downhill on a walking biking path towards evans but then took the turn too quickly crossing strawberry creek and fell over,4.0
80,i was on my bike on san pablo went to turn right to go to parker st i looked over my shoulder but not well car hit me asked if i was ok then drove,2.0
81,a skateboarder ran into me as i was slowly riding my bike there were so many pedestrians that neither one of us could change course the only path from north gate to hearst mining circle is very crowded and hard to bike on,1.0
82,the car stopped at the stop sign as i was crossing the street walking up channing crossing fulton but the young woman driving was too busy chatting with her friend in the passenger seat to look up before she hit the gas pedal the bumper hit my knee,3.0
83,i was inattentive and walked into the road it was dusk so i did not see a cyclist coming towards me the cyclist nearly hit me but stopped his bike just in time,2.0
84,i was walking to a meeting approaching sather gate from lower sproul around lunch time a bicyclist came zooming down in the opposite direction into a crowd of students and myself walking upstream he braked but could not stop fast enough he clipped me,4.0
85,the slope of the edge of the driveway was too uneven so when i tried to get on the sidewalk from the bike lane my wheel bumped it twisted and threw me off,1.0
86,i was in bike lane southbound on oxford car two cars ahead was turning right onto center and stopped quickly in the halfway in the bike lane half in vehicle lane caused the car behind it and immediately in front of me to slam on breaks caused me to m,2.0
87,pedestrian on sidewalk on shattuck lost hat in the wind it blew into the street was an elderly man not very mobile but he scurried out into the street i was on my bike waiting for the light to change going north on shattuck i was afraid he would get,2.0
88,i was going to class,1.0
89,i was headed home there was a large bump on the sidewalk and the front wheel of my scooter got caught and i flew over the scooter,1.0
90,my wheel melted when i was going downhill and using the footbrake,0.0
91,i was crossing bowditch and the approaching car tried to roll through the stop sign to turn onto bancroft the driver was inattentive and was only looking in one direction to look for oncoming traffic and did not see me she avoided hitting me and apolo,3.0
92,hearst and spruce,3.0
93,biking up to dwinelle from downtown the other vehicle was driven by the dissertation advisor of a close friend just a little scrape no biggie,2.0
94,i was walking on the bridge closest to life and science building and a cyclist was trying to go between students walking in both directions in doing so he hit me because he overcorrected in trying not to hit the other student walking in the opposite dire,0.0
95,i was bicycling past a large parked delivery truck and there really was not enough room my bicycle pedal hit the side of the truck and i fell off of my bike but was unhurt just embarrassed it was on the narrow roadway next to koshland hall where ther,1.0
96,both of the cyclists were headed toward the same restricted passage between bollards blocking automobile traffic from the intersection minor damage to bikes,3.0
97,i fell off my bike because i lost my balance,3.0
98,car was turning right from circle and stopped i did not expect them to stop so suddenly and didn t have time to react as i tried to go around them had to brace my hand against the trunk of the car to prevent myself from hitting the car they got out and,2.0
99,walking to class cyclist ran into me and fell on top of me,1.0
100,i was traveling from haas pavilion to th flagstone paved diagonal walkway by bicycle it was dark out i missed the ramp and hit the square curb dead on i flew over the front of my handlebars better lighting would have helped me avoid the ramp althoug,1.0
101,walking west on the road that connects north gate to the library of social welfare cyclist approached from behind at a high rate of speed and clipped my arm with his handlebar,4.0
102,i was crossing the street and the two cars closes to me did stop however the car in the third lane did not stop and i brushed with it as i was crossing the street and the car came to a very very sudden stop,3.0
103,there were lots of people and in an effort to avoid everyone i hit a rut in the path and had to jump off my bike,4.0
104,he opened his car door without looking and i could not stop in time i got thrown off my bike by his car door onto my back,2.0
105,hit by biker we both fell down,1.0
106,i was backing out of my driveway and tapped a person was going about 2 mph,1.0
107,i stopped at an intersection and tried to balance myself but just fell over,3.0
108,heading from gianinni to wurster going across harmon way in front of vlsb this is a common area for pedestrian congested pathways and i have seen other cyclists run into problems as well,4.0
109,i was riding my bike from giannini to wurster and just after crossing strawberry creek by faculty glade pedestrians were taking most of the path to the left and a skateboarder coming from the opposite direction was attempting to go around them and couldn,4.0
110,i was biking home late at night there was a pothole in the bike path that was not illuminated at the time the pothole was near moffit library and vlsb i emerged from around a bend and i rode right over the pothole and lost control of my bicycle and i,4.0
111,i was biking southward down the steep path indicated toward faculty glade and i saw many students in the path ahead i wanted to go down but i since the path was steep down the bridge i knew i could not stop in time so i instead turned onto the soil at,1.0
112,this actually happened twice to me basically i was crossing piedmont avenue at bancroft a car would be stopped at the stop sign i would be crossing and then s he would begin acceleration and slightly move forward and hit me fortunately in both cases,3.0
113,this actually happened twice to me basically i was crossing piedmont avenue at bancroft a car would be stopped at the stop sign i would be crossing and then s he would begin acceleration and slightly move forward and hit me fortunately in both cases,3.0
114,i was biking home from class on the street and my front tire fell off my bicycle causing me to flip over the handlebars and land on the concrete,2.0
115,cyclist riding in a no ride zone through sproul plaza going fast on a rainy day said his brekes were bad,0.0
116,cyclist ran red light on college ave at high speed i was crossing on haste st and swerved i hit his back tire,3.0
117,i was heading to class on campanile way towards the bell tower i was at the end of campanile way about to cross south hall road there was a lot of people walking around and i saw the cyclist going along south hall road so i decided to stop to let him go,4.0
118,walking to school i had right of way driver did not pay attention driver had a dog in her lap,3.0
119,cyclist just ran into me at slow speed,0.0
120,not serious heavy congestion on piedmont bike lane obstructed by shuttle bus at stop i was going to go around it but forced to stop short due to a large vehicle truck coming up from behind stopped in contact with shuttle bus hardly would describe as,2.0
121,this was not necessarily an accident per se but rather the car was speeding through a yield intersection and almost hit me i hit the car with my hand to propel me out of the way fortunately i was not hurt,3.0
122,a cyclist bumped into me from behind as i was walking on the sidewalk at the intersection on college and bancroft on the campus side i was going into kroeber hall,1.0
123,trying to cross at crosswalk vehicle appeared to stop for me so i began to cross but then the car started again and i had to stop suddenly falling off my bike,3.0
124,i was walking back to bowles and this cyclist hit me spot on he flipped off his bike but i was okay,4.0
125,i was crossing the street at a major crosswalk eastbound on bancroft from subway sandwiches to american apparel a student on a skateboard did not stop and wanted to cruise straight across to sproul hall slowed a little and still crashed into me,3.0
126,biking towards parking structure on my way to a final the road was wet it was raining and the wheels skidded and i crashed into the bike parking structure,1.0
127,i was walking out of a class from latimer building and walking towards home 4 00 pm after passing the moffit library i was just walking with several people surrounding me and a bike hit me run over me and then left the person that hit me do not even s,1.0
128,near wurster i was going home,4.0
129,riding down a steep hill towards upper sproul from the wurster morrison area on the bike pedestrian path pedestrian began running into the path of my bike just as i approached leaving me almost no time to react he was not paying attention i guess,4.0
130,slippery road caused me to hit curb and fall,4.0
131,someone opened their car door while i was riding by on my bicycle causing me to fall,2.0
132,crossing the street in front of another car and the car beside the one i was crossing did not see me crossing at all the vehicle is front bumper barely touched my leg,3.0
133,cyclist rode through a red light when pedestrians were already walking in the crosswalk,3.0
134,i was approaching a stop sign either on ellsworth or dana whichever has the stop on my bike going west on channing i was in the bike lane another cyclist had stopped at the stop sign for a very long time there was a car to the cyclists left but,2.0
135,one of the main problems with being a cyclist around pedestrians is when pedestrians stop moving because they see you coming then you have no idea when or in what direction they will choose to start to walk again i was riding my bike in the street a,3.0
136,i as crssond the road in an intersection and i hit a concrete lines separator i felt badly since i was riding my bike too fast,3.0
137,car followed the one ahead of it through a 4 way stop when i hd right of way,3.0
138,crashed my bike and wrenched my thumb and had a major contusion on leg,1.0
139,westbound on center i stopped for a red light at shattuck car behind me did not stop soon enough and made minor contact with my rear wheel profuese apology offered accepted,3.0
140,walking across campus,4.0
141,while i was walking west on the north side of the street at durant and telegraph a bike rider was on the side walk going south on telegraph we both came around the corner at the same time so the biker braked quickly grazed me flipped over the handle,1.0
142,crossing the intersection cyclist failed to yield to stop sign and clipped me the cyclist fell over everyone was fine,3.0
143,i heard a cyclist say watch out and i turned my head to see the cyclist on the left side and as i moved to the right he also moved to the right to avoid hitting me and others his bike handle got stuck to the string of my backpack and pulled me backwards,1.0
144,i was crossing the street at dwight and benvenue and came out from behind a parked car and was hit by a passing cyclist,0.0
145,i was crossing shattuck ave in the pedesttrian crossing lane when i was knocked down by a cyclist i was not hurt but ever since i have been wary of cyclists and worry about how fast they ride on the central campus weaving around pedestrians,0.0
146,i was biking to campus on college heading north i got to the intersection and began biking uphill past tdx the frat and a young man opened his vehicle door into me,2.0
147,i was biking down the hill and hit a part of the sidewalk that was raised it was covered with grass and leaves so i did not realize that i was going to fall,1.0
148,intersection hearst and oxford i was turning left from turn lane i had right of way oncoming car did not see me i was returning home from school,3.0
149,on roadway on campus where there is no sidewalk and a student on her phone abruptly stopped in the middle of the road i primarily commute to school by bike and it is frustrating that students are often on the road and often on their phones,0.0
