,x,y
150,i was come down bancroft way to enter the tennis court parking structure as i slowed down to turn right into the parking structure drive way the biker outside my line of sight was descending behind me down the grade to the right of my car i did not s,1.0
151,student going too fast down campanile way clipped me from behind as i was coming back from lunch and then lost control and fell scraping themselves some,1.0
152,crossing street while going out to lunch on telegraph was slightly jostled and tripped and fell hitting hands on pavement and getting glass in palms,1.0
153,bicyclist approaching from behind without warning on a sidewalk hit my hand with my morning coffee,1.0
154,two college age bicyclists winding in and out of foot traffic on the sidewalk on telegraph they bumped me and another person from behind,1.0
155,elbow clipped by bicyclist who approached from behind while walking on the grinnell pathway,1.0
156,i was riding north on college ave towards bancroft after stopping at the stop sign and the cars on bancroft were stopped as well i began to ride across bancroft and was hit by a cyclist who was riding very fast and did not stop at the stop sign i did,3.0
157,i was crossing the street in crosswalk from vehicle is right vehicle was turning right at stop sign but never stopped until i banged on hood she was looking left to see car traffic did not look for pedestrian traffic from right did not stop at sidewal,3.0
158,i was crossing telegraph avenue mid block since it is a one way street i was looking in the direction of the oncoming traffic to make sure there was no traffic coming i did not see the bicycle approaching from the wrong direction and it hit me as i,0.0
159,walking to my parking lot and bike sped around a corner behind me striking my arm knocking my phone out of my hand the pathway was not very wide and he was headed downhill too fast,4.0
160,i was heading south on piedmont on the side of the road coming down the hill i was a little fast however the primary issue was that there was an amount of fine gravel and dust in the roadway which made me lose traction and slide onto the sidewalk at,2.0
161,the front brakes stuck and i went over the handlebars this took place in road i think i would have been safer had there been a bike lane but primarily the bike was to blame so i stopped using that bike soon afterwards,2.0
162,caught my pedal on the roadway making a hard left turn from shattuck onto berkeley way on the way to work flipped and came down hard no one is fault but my own,2.0
163,i was traveling south on college toward haste on my bike and a cyclist passed me with great speed to my right side it caused me to tip to the left where a car was very close to the bike lane scraped against my bike,2.0
164,was carrying a paper in my hand while biking when it started to blow away i hit the brakes too hard and went down,2.0
165,i had pulled into the intersection too far and was backing up my car slowly to stop blocking the crossways i was going very slowly when a girl suddenly emerged from behind the parked cars not going in the intersection it just a hey im here situatio,3.0
166,i was riding down the street and my bike chain slipped off my chain ring in the back it had loosened up over time and i did not tighten up my hub so it slipped off locking up and making me fall i wiped out a car behind me stopped a pedestrian i was,2.0
167,i fell down the stairs that are on the north side of the stadium because the railing was not usable i did not report it to the police b c i was not injured but i did report it to someone on campus and they fixed the stairs,0.0
168,a uc van was parked across the road at university drive and south hall road i attempted to bike around it but there was not enough room and my handlebars hit the side of the van no damage,2.0
169,i was biking down south drive and went to turn right on university drive when a pedestrian who had just posed for a picture stepped off the sidewalk without looking right into my bike thankfully i braked and did not run her over she was not paying attent,2.0
170,the pavement on the roadway on south drive near the chemistry and chemical engineering library has a deep grove in it right where the road meets the sidewalk since there is vehicle and pedestrian traffic on that road all the time it is difficult to bike,2.0
171,i was emerging from the driveway loading dock area behind barker hall at the corner of hearst oxford st on my bicycle when a bicyclist who was heading west downhill on hearst on the wrong left hand of the road at a high rate of speed slammed on hi,1.0
172,i was cycling south on walnut st on the right hand side of the road as i passed by the peete is coffee just beyond the intersection of walnut and vine st the driver of a parked car who by her own admission paid no attention to whether there were an,2.0
173,i had been walking to class when the cyclist rode into me from behind,1.0
174,i got hit by a car,3.0
175,walking between giannini and calif hall a bike zoomed behind me and bumped me but did not fall himself too fast no bike lane and students in a hurry minor accidents happen here often,4.0
176,starting to cross campus near moffit library student was racing across campus and swerving among pedestrians,4.0
177,riding slowly near moffit bike came from near calif hall pedestrian group expanded and we both swerved to miss them that area near coffee shop is dangerous bikes often go too fast but pedestrians also do not pay attention,4.0
178,pedestrian cycling path was busy with pedestrians i was coming down the hill on a bike and the other cyclist was walking their bike up i went on the right side of the path and the other cyclist moved the left maneuvering into my path and we collided,4.0
179,hit the right side of a car when it was making a right turn into a parking structure without signaling,2.0
180,i began turning right to enter the covered lot east of hearst gym and suddenly the cyclist hit the right side of my car and landed on the street in front of me an ambulance soon arrived and i assume he was taken to the er the police asked whether i,2.0
181,was going to class at 930 am i stopped at the intersection of a 4 ways stop sign she was crossing the road illegally between cars which parked along the street couldnt see her cars blocked her she is about 5 1 she was eating popcorn and i hid her o,3.0
182,i was walking on the traffic way and the cyclist approached from the back of me i was trying to avoid him but his speed was high so we collided and i fell,3.0
183,i was walking on the way when the cyclist approached me from the behind,2.0
184,i was biking between two buses one of them moved while i was biking through and i got scared and my bike fell the bus had run over the rear rack of my bike as a result,2.0
185,i was riding around the corner turning left it was wet and had just rained and i turned just as i was riding over the wet metal plates so my wheels slipped out from under me and i fell,2.0
186,i was biking along the uneven pavement brick surface and my wheel caught causing the wheels to torque and i fell on my bike,1.0
187,i was riding down the bridge on a rainy day several pedestrians were walking in the opposite direction blocking the bridge i could not brake in time because the rain impeded the functionality of my brakes and so i slowly ran into the pedestrian who was,4.0
188,i was riding in the opposite direction as another cyclist who i knew and when we saw each other as we said hi he ran into another cyclist,4.0
189,grazed pedestrian on the bridge she did not yield when i said i was on her left and did not fully understand me,1.0
190,was going home fell off bike on the way down the hill next to pimentel because of poor lighting and uneven roadway had to go to hospital for fractured arm and concussion,2.0
191,bicyclist was riding down a multi use path at high speed in the early darkness rain caused the path to be slick the cyclist upon noticing me slammed on his brake but still skidded into me knocking me about a foot away resulted in a minor bruise,4.0
192,when turning the corner just southwest of the campanile my tire caught in one of the cracks in the pavement on the road and i hit the ground hard the skin of three knuckles were completely ripped off i broke one finger and of course got road rash,2.0
193,the car had stopped at the stop sign at the intersection as i started walking across the designated crossing area i noticed the driver had his head turned away from me looking at female walking on the sidewalk he then started driving forward while st,3.0
194,i was walking on the pathway when a cyclist ran into me he admitted that he was the guilty party and apologized,4.0
195,biker was on sidewalk and almost ran straight into me as the tried to pass someone walking the other way they started to break and i grabbed their handlebars to prevent the bike from hitting me,1.0
196,was walking in between doe and moffit libraries and biker cut in front of me to avoid hitting someone else,4.0
197,cyclist blew through a stop sign while i was in the cross walk,3.0
198,i fell while riding in a group of cyclists after swerving to avoid a pothole i scraped my leg up,2.0
199,driver decided to make a last minute right hand turn and did not check to see if there was someone me in the bike line before making an abrupt right turn in front of me there was not enough room time to stop and so i collided into the vehicle,3.0
200,vehicle turned right as i was crossing the road at the intersection causing me to hit the passenger door of the vehicle i chased him down to the next light to get the license number and report it he slammed on the brakes causing me to impact the back of,3.0
201,i was doored driver opened door quickly as i was passing by did not have time to apply brakes,2.0
202,in cross walk crossing oxford from addison cars do not yield to people in this crosswalk a great deal had to move out of way also say a lady with a baby stroller almost run down by a car in this crosswalk very dangerous,0.0
203,in crosswalk walking across oxford from addison cars constantly run this cross walk and it is very dangerous,0.0
204,cyclist elected not to sick medical attention,2.0
205,i was riding with a bag on my upper arm i had to break suddenly and the bag slipped down my arm and got caught between the front fork and the rim i was going around 12 14 mph the bike stopped suddenly and flipped over i landed on my face,2.0
206,while walking to work throuhg campus going uphill person on bike was coming downhill walk way was crowded with other people walking person on bike was trying to avoid hitting people but succeeded in running into me,4.0
207,heading west on bancroft went to turn right on the the haas pavilion pathway and slipped on the wet pavement going too fast on a wet road while making a 90 degree turn landed on my back pack and bruised my leg w the handle bar,0.0
208,walking to class on a wide path way and staying to the right to allow room for traffic biker behind me and decides to squeeze more to the right between me and a wall rather than using the rest of the wider path bike hits and runs up my ankle leg and sid,4.0
209,bicyclists often ignore traffic laws,3.0
210,1 bridge over creek is too narrow 2 heavy new student foot traffic causing obstruction 3 dirt on west side of bridge often is wet tree debris 4 slid out during emergency stop to avoid student,4.0
211,vehicle turning from bancroft into mlk parking garage did not pay attention to pedestrians crossing the parking lot entrance in the crosswalk i was one fo the pedestrians crossing the crosswalk i was able to mostly evade the vehicle before it hit me s,3.0
212,was crossing walkingin the street on a protected cross and a biker hit me,3.0
213,while three lanes of traffic stopped for me a van decided to jump the fourth close enough that i was able to slap the side of the van as breezed in front of me,3.0
214,bicyclist struck me and another woman while heading at high speed down the path we all went down he picked up his pick flipped us of calling us assholes and carried on his way with a slightly bent wheel,4.0
215,crowded shared path inexperienced rider that ran into me too much speed coming down small hill,4.0
216,hill too much speed and inexperienced rider on shared path too many people on path to get out of the way,4.0
217,why bother this survey is biased towards the idiot bikes bike riders should be required to take a driving test they should be ticketed when disobeying the law,1.0
218,why bother this survey is biased towards the idiot bikes,2.0
219,i am sick and tired of bikes riding in the crosswalk my car maintained 1700 in rear end damage because i stopped for one of these idiots and the person behind me did not,0.0
220,i am sick and tired of bikes on the sidewalk and in the crosswalks with no regard for pedestrians there is never any enforcement by uc or city police,1.0
221,i am sick and tired of idiot bikes on the sidewalks ignoring all common sense and traffic regulations,1.0
222,riding down claremont avenue i saw a car at the woolsey intersection that did not make a clear stop at a stop sign perhaps she was going to stop but i could not tell for certain i broke hard as i hit pavement with a depression around a manhole and cr,2.0
223,car in front of me stopped suddenly and i was too close,2.0
224,pedestrian crossed the street mid block on a diagonal at the last moment rather than continuing to the curb the pedestrian straightened his path and stayed in the street i broke hard to avoid hitting him he was wearing earbuds,2.0
225,i was on my way to class and trying to ride my bike onto part of a driveway on the sidewalk but the angle i attempted to ride caused my tires to not follow where my body was going so essentially i fell forward onto the wet pavement,1.0
226,i was riding south on shattuck crossing woolsey the car that hit me was going north on shattuck making a left onto woolsey there were other cars going south on shattuck beside me they went thru the intersection first and i followed the car thought it,3.0
227,i was walking on the path and the cyclist came perpendicularly on his path i saw him and stopped so he could go around but he was going too fast and slammed directly into me sending me sprawling i hid my head and elbow on the ground and scuffed my com,4.0
228,walking home from campus during lunch crossed street did not see cyclist due to passing van which blocked view once we saw each other neither was sure which way to go,0.0
229,i was crossing the crosswalk outside strada intersection and out of nowhere the cyclist just rode his bicycle right in front of me making me to have a sharp stop myself,3.0
230,same as accident 1 i was crossing the crosswalk outside strada intersection and out of nowhere the cyclist just rode his bicycle right in front of me making me to have a sharp stop myself,3.0
231,on my way to work while i was making a left turn from dwight onto bowditch a bicyclist traveling sb in the sb lane abruptly changed to the nb lane while still moving sb i swerved and braked to avoid him and came to a stop in a parking space the cyclis,3.0
232,while parking arriving for work i was trying to park on the ns of north sproul lot and was signaling due to pedestrians i was moving slowly and was almost completely parked when a cyclist ran into the rear right tire area of my car he stated he was go,0.0
233,i was the first bicycle waiting at the red light on dana to cross haste i was on the right side of the rightmost lane a cyclist pulled up on my left and entered the crosswalk it appeared he intended to blow the red light if traffic cleared the lig,2.0
234,my bike was parked on campus near sproul hall and someone must have tampered with my handlebars because they were very loose and when i got on my bike and tried to use the brakes my handlebars flipped down and i flipped over my bike and fell i did not le,1.0
235,this accident was completely my fault i was trying to balance a shipping box with one hand steer with one hand and was not wearing a helmet i braked too hard fell off my bike and lightly cut the top of my head on the ground i learned a big lesson th,2.0
236,skate boarder crashed into me because he was talking on a cell phone and not paying attention,1.0
237,bicycle ran over my feet when i was trying to cross the street i hurt my back trying to jump away,3.0
238,bicyclist was riding like an idiot and not obeying any signs and was in a huge hurry,2.0
239,bike swerved to avoid pothole and hit my van,2.0
240,had to turn sharply to avoid a pedestrian and hit the back of a parked car while turning,0.0
241,car turning right and did not see me,2.0
242,there is a treacherous bit of slick pavement by gilman if you do not come at the right angle it is easy to go down more embarrassing for me than anything else,4.0
243,wind picked up my hat as i was going down a slight hill and when i turned around to grab it i flew off my bike and ate shit,4.0
244,i was coming down the hill from hearst mining circle and when i attempted to sharply turn onto s hall road the turn was a lot sharper then i had envisioned so my bike was going to run into the sidewalk and then the library i started to break but was goin,4.0
245,i was in the crosswalk at oxford and university north side of intersection and crossing with the light i was struck by a car making a left turn and rendered unconscious i suffered a serious concussion and minor physical injuries the car suffered a de,3.0
246,i was walking north toward sather gate a bicyclist ran into me from the pathway going to the east end of campus near barrows i do not know what that is called this area is a known problem area,1.0
247,i was walking west on bancroft and i was clipped by a cyclist riding on the sidewalk bancroft was busy and there were multiple blockages the bike came up on the sidewalk where the parking exit was i was just past that,1.0
248,i was crossing bancroft going west at oxford i started to walk to the crosswalk to the other side of the street there was a little crosswalk to get past cars going right and a cyclist c made the turn and clipped my backpack no big deal but it could,3.0
249,on channing going west crossing telegraph light in my direction turned green crossed intersection when pedestrian stepped off curb in front of me had no time to avoid pedestrian if i had time and veered left i would have crashed into car in west bound,2.0
250,i was west bound on channing in bicycle lane car passed me then crossed in front for parking i hit passenger side of car at 15 20 mph left hand injured required paramedics but not ambulance went to er via private vehicle extreme damage to bike e g,2.0
251,the cyclist hit me from behind and acted like it was my fault this happened at the corner of euclid hearst as i was turning right to go down hill on hearst,2.0
252,car pulled into parking space abruptly cutting me off,2.0
253,car came through a stop sign and hit me,3.0
254,a young man thought he could just speed by and did not leave me enough room,4.0
255,i was riding my bike down university when i got to the point where the lane blocks were a pedestrian walked out in front of me in order to avoid him i went off the road and crashed into a pole,2.0
256,i was riding down hearst and tried to stop at the stoplight i went to put my foot down on the sidewalk missed and fell over,2.0
257,crazy cyclist speeding and weaving hit me you people at cal have to do something to stop this it is an outrage and someone is going to get seriously hurt one day by cyclists do something,4.0
258,i was riding on the pathway near vlsb and there was a large group of people walking toward me i thought i could go between some of the people but they did not see me and one of the guys moved suddenly into my path he then saw me and grabbed my handleba,0.0
259,i was walking to class by dwinelle a cyclist came my way and i tried to dodge him we bumped into each other he said sorry and continued to go on his way,4.0
260,i was walking to class a cyclist was speeding down the hill by vlsb behind and came into contact with me by pushing me out of the way,4.0
261,crossing from south to north across university ave car going south on oxford turned right on red onto university while we had a walk sign,3.0
262,crossing at hearst and oxford i had a walk signal but a truck was trying to make a right turn we made eye contact but i think he misread i continued to cross and he accelerated into the intersection to make a right turn at the same time and had to s,3.0
263,from garage exit on berkely way left onto oxford my attention on on coming car traffic turned into crosswalk with pedestrian there,3.0
264,bancroft and bowditch intersection i was crossing the street cars going north on bowditch and west on bancroft were all stopped for me but a biker did not stop and came westbound on bancroft at high speed and nearly hit me enough to swipe my coat and c,3.0
265,cyclist running through light too fast did not want or could not stop for pedestrians to cross,3.0
266,cyclist running through light too fast did not want or could not stop for pedestrians to cross,3.0
267,people walk on the narrow roadway because there is not a sidewalk in this location,2.0
268,i was cycling down bancroft and a vehicle cut in front of me into a parking place she did not even look first i swerved and the side of her car with my leg but was not injured she did not even realize that she had cut me off,2.0
269,i was crossing cedar going south on the west side of spruce i looked before crossing a driver was travelling north on spruce and made a left turn onto cedar did not see me and ran into me i was on my way to work she apologized saying that her windsh,3.0
270,commuting home after work riding south on college in lead line with 4 other cyclists car opened door suddenly opened broke elbow clavicle and pelvis did not take bowditch bike path because of potholes and car traffic on bancroft never looks right and,2.0
271,i was riding home at night and a car pulled into a driveway in front of me suddenly and without signalling i did not brake in time and slammed into the trunk of the car the car braked almost immediately and i was able to extricate myself from my bike,2.0
272,university ave eastbound left turning traffic at oxford often turns in front of cars exiting campus westbound this causes confusion for drivers and hazards for pedestrians in crosswalks running east west through intersection often witness near miss,3.0
273,pedestrians crossing oxford st at addison on designated cross walks mid block are routinely threatened with being hit by cars bicycles not stopping on oxford st there should be at least 3 way stop signs at this intersection for pedestrian safety,3.0
274,bicyclists coming from behind on the sidewalk when there are people walking in both directions likely going to fast and unwilling to walk the bike rather than ride occurred at least twice,1.0
275,i was biking on a narrow bike pedestrian path on campus the other biker was coming down the hill towards me and could not decide which way to go around me instead of staying to the right as a driver should do he wavered then crashed straight into me a,4.0
276,i was walking to campus in the rain and a car did not see me and bumped me as they stopped at the last minute,3.0
277,to avoid construction work blocking bike lane went up onto sidewalk rode over power washing hose and bicycle flipped sideways onto wet pavement was near telegraph at channing way on way to work,1.0
278,shattuck and center heading towards campus on the north side,3.0
279,my bike chain broke and i fell as the bike lurched i was coming back to campus from lunch in downtown berkeley i was pedalling uphill standing up and my chain broke and i fell over banged my knee and scrapped some hands located near west gate,1.0
280,i was biking home after work i was on a street durant west of telegrahp that did not have a designated bike lane i was uneducated to the berkeley bike boulevards which i now know it must have been summer ish time because it was fully light o,2.0
281,entering university ave w b from campus was struck by e b motorist making left onto oxford,3.0
282,w b hearst between shattuck and oxford,2.0
283,i was crossing the street and the biker was traveling up bancroft against traffic he was attempting to turn and did not stop when people had already started crossing he scraped me and another person,3.0
284,i was crossing the street from the campus side of bancroft to the south west corner of bowditch and bancroft and they did not stop at the stop sign,3.0
285,i was heading westbound on the road between giannini hall the library it had just rained the wooden bridge was slippery i did not anticipate how slippery when i took the curve on the bridge my bike slid out from under me and i fell no one else,1.0
286,i was crossing in the crosswalk and a cyclist zoomed past me super fast just swiped my arm no injury but pretty scary he could have run me over,3.0
287,riding across campus near the law school,1.0
288,i was trying to adjust something maybe a strap so i took my hands off the handle bar for a split second,2.0
289,the car next to me swerved right so i swerved right and my tire hit the uneven joing between the concrete gutter and the asphalt and i flew over my handle bars but was ok just scraped my hands,2.0
290,a small dog was running parallel to me on my right side and then immediately turned left in front of me i swerved to avoid him but ended up slamming him with my front wheel and flipping off my bike,2.0
291,my bike slipped on the wet grating after it rained,4.0
292,a car going west on channing was turning left onto shattuck and i attempted to pass it on the right on my bike i was going west on channing and crossing shattuck in the last second and without signaling the driver changed her mind and decided to turn,3.0
